<?xml version="1.0" encoding="UTF-8"?>
<registro xmlns:xsi="http://www.w3.org/2001/XMLSchema-instance"
          xsi:noNamespaceSchemaLocation="registro.xsd">

    <usuario identificador="U123">
        <apellidos_nombre>Sanz Tapia,Ana</apellidos_nombre>
        <email>asanz@jmail.com</email>

        <conexiones>
            <conexion fecha="2014-02-23" hora="19:15:40">122</conexion>
            <conexion fecha="2014-02-23" hora="20:30:22">617</conexion>
            <conexion fecha="2014-02-24" hora="11:18:31">25</conexion>
        </conexiones>

    </usuario>

    <usuario identificador="U96">
        <apellidos_nombre>Ruiz Hierro,Pedro</apellidos_nombre>
        <email>pruiz@jotmail.com</email>
        <conexiones>
            <conexion fecha="2014-02-25" hora="20:33:55">390</conexion>
        </conexiones>
    </usuario>

    <empleado identificador="E4">
        <apellidos_nombre>Vera Gil,Marta</apellidos_nombre>
        <email>mvera@yajoo.es</email>
        <conexiones/>
        <departamento>
            <marketing />
        </departamento>
    </empleado>
</registro>
